Warning: Using a password on the command line interface can be insecure.
--------------
SHOW DATABASES
--------------

+--------------------+
| Database           |
+--------------------+
| information_schema |
| 36_assign2db       |
| mysql              |
| performance_schema |
| vetoffice          |
+--------------------+
5 rows in set (0.00 sec)

--------------
SELECT * FROM bus
--------------

+----------+----------+
| capacity | plateNum |
+----------+----------+
|       50 | CAND123  |
|        4 | TAXI111  |
|        3 | TAXI222  |
|        4 | TAXI333  |
|       70 | UWO1122  |
|       62 | UWO3311  |
|       10 | VAN1111  |
|       15 | VAN2222  |
+----------+----------+
8 rows in set (0.00 sec)

ERROR 2 (HY000) at line 4: File '/root/yni58/assignment2/busData.txt' not found (Errcode: 2 - No such file or directory)
--------------
LOAD DATA LOCAL INFILE '~/yni58/assignment2/busData.txt' INTO TABLE bus FIELDS TERMINATED BY ','(plateNum,capacity)
--------------

--------------
SELECT * FROM bus
--------------

+----------+----------+
| capacity | plateNum |
+----------+----------+
|       50 | CAND123  |
|        4 | TAXI111  |
|        3 | TAXI222  |
|        4 | TAXI333  |
|       70 | UWO1122  |
|       62 | UWO3311  |
|       10 | VAN1111  |
|       15 | VAN2222  |
+----------+----------+
8 rows in set (0.00 sec)

--------------
SELECT * FROM busTrip
--------------

+------------+------------+------------+----------------------------+--------+----------+
| start      | end        | county     | tripName                   | tripID | plateNum |
+------------+------------+------------+----------------------------+--------+----------+
| 2022-01-01 | 2022-01-17 | Germany    | Castles of Germany         |      1 | VAN1111  |
| 2022-03-03 | 2022-03-14 | Italy      | Tuscany Sunsets            |      2 | TAXI222  |
| 2022-05-05 | 2022-05-10 | USA        | California Wines           |      3 | VAN1111  |
| 2022-04-04 | 2022-04-14 | Bermuda    | Beaches Galore             |      4 | TAXI222  |
| 2022-06-01 | 2022-06-22 | Canada     | Cottage Country            |      5 | CAND123  |
| 2022-07-05 | 2022-07-15 | Italy      | Arrivaderci Roma           |      6 | TAXI111  |
| 2022-09-09 | 2022-09-29 | UK         | Shetland and Orkney        |      7 | TAXI111  |
| 2022-06-10 | 2022-06-20 | USA        | Disney World and Sea World |      8 | VAN1111  |
| 2022-02-05 | 2022-02-10 | USA        | Kingston Jamaica           |      9 | VAN1111  |
| 2022-09-05 | 2022-09-15 | Mozambique | Maputo                     |     10 | CAND123  |
+------------+------------+------------+----------------------------+--------+----------+
10 rows in set (0.00 sec)

ERROR 1062 (23000) at line 7: Duplicate entry '1' for key 'PRIMARY'
ERROR 1062 (23000) at line 8: Duplicate entry '2' for key 'PRIMARY'
ERROR 1062 (23000) at line 9: Duplicate entry '3' for key 'PRIMARY'
ERROR 1062 (23000) at line 10: Duplicate entry '4' for key 'PRIMARY'
ERROR 1062 (23000) at line 11: Duplicate entry '5' for key 'PRIMARY'
ERROR 1062 (23000) at line 12: Duplicate entry '6' for key 'PRIMARY'
ERROR 1062 (23000) at line 13: Duplicate entry '7' for key 'PRIMARY'
ERROR 1062 (23000) at line 14: Duplicate entry '8' for key 'PRIMARY'
ERROR 1062 (23000) at line 15: Duplicate entry '9' for key 'PRIMARY'
ERROR 1062 (23000) at line 16: Duplicate entry '10' for key 'PRIMARY'
--------------
INSERT INTO busTrip (tripID,tripName,start,end,county,plateNum) VALUES (1, "Castles of Germany","2022-01-01", "2022-01-17", "Germany", "VAN1111")
--------------

--------------
INSERT INTO busTrip (tripID,tripName,start,end,county,plateNum) VALUES (2, "Tuscany Sunsets", '2022-03-03', '2022-03-14', 'Italy', 'TAXI222')
--------------

--------------
INSERT INTO busTrip (tripID,tripName,start,end,county,plateNum) VALUES (3, "California Wines", '2022-05-05','2022-05-10', 'USA', 'VAN2222')
--------------

--------------
INSERT INTO busTrip (tripID,tripName,start,end,county,plateNum) VALUES (4, "Beaches Galore", '2022-04-04','2022-04-14', 'Bermuda', 'TAXI222')
--------------

--------------
INSERT INTO busTrip (tripID,tripName,start,end,county,plateNum) VALUES (5, "Cottage Country", '2022-06-01','2022-06-22', 'Canada', 'CAND123')
--------------

--------------
INSERT INTO busTrip (tripID,tripName,start,end,county,plateNum) VALUES (6, "Arrivaderci Roma", '2022-07-05','2022-07-15', 'Italy', 'TAXI111')
--------------

--------------
INSERT INTO busTrip (tripID,tripName,start,end,county,plateNum) VALUES (7, "Shetland and Orkney", '2022-09-09','2022-09-29', 'UK', 'TAXI111')
--------------

--------------
INSERT INTO busTrip (tripID,tripName,start,end,county,plateNum) VALUES (8, "Disney World and Sea World", '2022-06-10','2022-06-20', 'USA', 'VAN2222')
--------------

--------------
INSERT INTO busTrip (tripID,tripName,start,end,county,plateNum) VALUES (9, "Kingston Jamaica", '2022-02-05','2022-02-10', 'USA', 'VAN2222')
--------------

--------------
INSERT INTO busTrip (tripID,tripName,start,end,county,plateNum) VALUES (10, "Maputo", '2022-09-05','2022-09-15', 'Mozambique', 'CAND123')
--------------

--------------
SELECT * FROM busTrip
--------------

+------------+------------+------------+----------------------------+--------+----------+
| start      | end        | county     | tripName                   | tripID | plateNum |
+------------+------------+------------+----------------------------+--------+----------+
| 2022-01-01 | 2022-01-17 | Germany    | Castles of Germany         |      1 | VAN1111  |
| 2022-03-03 | 2022-03-14 | Italy      | Tuscany Sunsets            |      2 | TAXI222  |
| 2022-05-05 | 2022-05-10 | USA        | California Wines           |      3 | VAN1111  |
| 2022-04-04 | 2022-04-14 | Bermuda    | Beaches Galore             |      4 | TAXI222  |
| 2022-06-01 | 2022-06-22 | Canada     | Cottage Country            |      5 | CAND123  |
| 2022-07-05 | 2022-07-15 | Italy      | Arrivaderci Roma           |      6 | TAXI111  |
| 2022-09-09 | 2022-09-29 | UK         | Shetland and Orkney        |      7 | TAXI111  |
| 2022-06-10 | 2022-06-20 | USA        | Disney World and Sea World |      8 | VAN1111  |
| 2022-02-05 | 2022-02-10 | USA        | Kingston Jamaica           |      9 | VAN1111  |
| 2022-09-05 | 2022-09-15 | Mozambique | Maputo                     |     10 | CAND123  |
+------------+------------+------------+----------------------------+--------+----------+
10 rows in set (0.00 sec)

--------------
SELECT * FROM passport
--------------

+------------+-------------+------------+-------------+
| birth      | passportNum | expiry     | citizenship |
+------------+-------------+------------+-------------+
| 1970-07-12 | GE11        | 2027-01-01 | Germany     |
| 1970-02-19 | US10        | 2025-01-01 | USA         |
| 1972-08-12 | US12        | 2025-01-01 | USA         |
| 2001-05-12 | US13        | 2025-01-01 | USA         |
| 2004-03-19 | US14        | 2025-01-01 | USA         |
| 2012-09-17 | US15        | 2025-01-01 | USA         |
| 1950-06-11 | US22        | 2030-04-04 | USA         |
| 1940-06-24 | US23        | 2018-03-03 | USA         |
| 1979-02-19 | US56        | 2025-01-01 | USA         |
| 1979-04-25 | US88        | 2030-02-13 | Canada      |
| 1976-04-08 | US89        | 2022-02-02 | Germany     |
| 1980-04-04 | US90        | 2020-02-28 | Italy       |
| 1959-02-02 | US91        | 2030-01-01 | Germany     |
+------------+-------------+------------+-------------+
13 rows in set (0.00 sec)

ERROR 1054 (42S22) at line 19: Unknown column 'pID' in 'passport'
ERROR 1062 (23000) at line 20: Duplicate entry 'US10' for key 'PRIMARY'
ERROR 1062 (23000) at line 21: Duplicate entry 'US12' for key 'PRIMARY'
ERROR 1062 (23000) at line 22: Duplicate entry 'US13' for key 'PRIMARY'
ERROR 1062 (23000) at line 23: Duplicate entry 'US14' for key 'PRIMARY'
ERROR 1062 (23000) at line 24: Duplicate entry 'US15' for key 'PRIMARY'
ERROR 1062 (23000) at line 25: Duplicate entry 'US22' for key 'PRIMARY'
ERROR 1062 (23000) at line 26: Duplicate entry 'US23' for key 'PRIMARY'
ERROR 1062 (23000) at line 27: Duplicate entry 'GE11' for key 'PRIMARY'
ERROR 1062 (23000) at line 28: Duplicate entry 'US88' for key 'PRIMARY'
ERROR 1062 (23000) at line 29: Duplicate entry 'US89' for key 'PRIMARY'
ERROR 1062 (23000) at line 30: Duplicate entry 'US90' for key 'PRIMARY'
ERROR 1062 (23000) at line 31: Duplicate entry 'US91' for key 'PRIMARY'
ERROR 1062 (23000) at line 32: Duplicate entry 'US56' for key 'PRIMARY'
--------------
ALTER TABLE passport MODIFY pID INT
--------------

--------------
INSERT INTO passport (passportNum,citizenship,expiry,birth) VALUES ('US10','USA','2025-01-01','1970-02-19')
--------------

--------------
INSERT INTO passport (passportNum,citizenship,expiry,birth) VALUES ('US12','USA','2025-01-01','1972-08-12')
--------------

--------------
INSERT INTO passport (passportNum,citizenship,expiry,birth) VALUES ('US13','USA','2025-01-01','2001-05-12')
--------------

--------------
INSERT INTO passport (passportNum,citizenship,expiry,birth) VALUES ('US14','USA','2025-01-01','2004-03-19')
--------------

--------------
INSERT INTO passport (passportNum,citizenship,expiry,birth) VALUES ('US15','USA','2025-01-01','2012-09-17')
--------------

--------------
INSERT INTO passport (passportNum,citizenship,expiry,birth) VALUES ('US22','USA','2030-04-04','1950-06-11')
--------------

--------------
INSERT INTO passport (passportNum,citizenship,expiry,birth) VALUES ('US23','USA','2018-03-03','1940-06-24')
--------------

--------------
INSERT INTO passport (passportNum,citizenship,expiry,birth) VALUES ('GE11','Germany','2027-01-01','1970-07-12')
--------------

--------------
INSERT INTO passport (passportNum,citizenship,expiry,birth) VALUES ('US88','Canada','2030-02-13','1979-04-25')
--------------

--------------
INSERT INTO passport (passportNum,citizenship,expiry,birth) VALUES ('US89','Canada','2022-02-02','1976-04-08')
--------------

--------------
INSERT INTO passport (passportNum,citizenship,expiry,birth) VALUES ('US90','Italy','2020-02-28','1980-04-04')
--------------

--------------
INSERT INTO passport (passportNum,citizenship,expiry,birth) VALUES ('US91','Germany','2030-01-01','1959-02-02')
--------------

--------------
INSERT INTO passport (passportNum,citizenship,expiry,birth) VALUES ('US56','USA','2025-01-01','1979-02-19')
--------------

--------------
SELECT * FROM passport
--------------

+------------+-------------+------------+-------------+
| birth      | passportNum | expiry     | citizenship |
+------------+-------------+------------+-------------+
| 1970-07-12 | GE11        | 2027-01-01 | Germany     |
| 1970-02-19 | US10        | 2025-01-01 | USA         |
| 1972-08-12 | US12        | 2025-01-01 | USA         |
| 2001-05-12 | US13        | 2025-01-01 | USA         |
| 2004-03-19 | US14        | 2025-01-01 | USA         |
| 2012-09-17 | US15        | 2025-01-01 | USA         |
| 1950-06-11 | US22        | 2030-04-04 | USA         |
| 1940-06-24 | US23        | 2018-03-03 | USA         |
| 1979-02-19 | US56        | 2025-01-01 | USA         |
| 1979-04-25 | US88        | 2030-02-13 | Canada      |
| 1976-04-08 | US89        | 2022-02-02 | Germany     |
| 1980-04-04 | US90        | 2020-02-28 | Italy       |
| 1959-02-02 | US91        | 2030-01-01 | Germany     |
+------------+-------------+------------+-------------+
13 rows in set (0.00 sec)

--------------
SELECT * FROM passenger
--------------

+-----------+----------+-----+-------------+
| firstName | lastName | pID | passportNum |
+-----------+----------+-----+-------------+
| Homer     | Simpson  |  11 | US10        |
| Marge     | Simpson  |  22 | US12        |
| Bart      | Simpson  |  33 | US13        |
| Lisa      | Simpson  |  34 | US14        |
| Maggie    | Simpson  |  35 | US15        |
| Ned       | Flanders |  44 | US22        |
| Todd      | Flanders |  45 | US23        |
| Heidi     | Klum     |  66 | GE11        |
| Michael   | Scott    |  77 | US88        |
| Dwight    | Schrute  |  78 | US89        |
| Pam       | Beesly   |  79 | US90        |
| Creed     | Bratton  |  80 | US91        |
| Shawn     | Kim      |  90 | US91        |
+-----------+----------+-----+-------------+
13 rows in set (0.00 sec)

ERROR 1062 (23000) at line 35: Duplicate entry '11' for key 'PRIMARY'
ERROR 1062 (23000) at line 36: Duplicate entry '22' for key 'PRIMARY'
ERROR 1062 (23000) at line 37: Duplicate entry '33' for key 'PRIMARY'
ERROR 1062 (23000) at line 38: Duplicate entry '34' for key 'PRIMARY'
ERROR 1062 (23000) at line 39: Duplicate entry '35' for key 'PRIMARY'
ERROR 1062 (23000) at line 40: Duplicate entry '44' for key 'PRIMARY'
ERROR 1062 (23000) at line 41: Duplicate entry '45' for key 'PRIMARY'
ERROR 1062 (23000) at line 42: Duplicate entry '66' for key 'PRIMARY'
ERROR 1062 (23000) at line 43: Duplicate entry '77' for key 'PRIMARY'
ERROR 1062 (23000) at line 44: Duplicate entry '78' for key 'PRIMARY'
ERROR 1062 (23000) at line 45: Duplicate entry '79' for key 'PRIMARY'
ERROR 1062 (23000) at line 46: Duplicate entry '80' for key 'PRIMARY'
ERROR 1062 (23000) at line 47: Duplicate entry '90' for key 'PRIMARY'
--------------
INSERT INTO passenger (pID,firstName,lastName,passportNum) VALUES (11, "Homer", "Simpson", "US10")
--------------

--------------
INSERT INTO passenger (pID,firstName,lastName,passportNum) VALUES (22, "Marge", "Simpson", "US12")
--------------

--------------
INSERT INTO passenger (pID,firstName,lastName,passportNum) VALUES (33, "Bart", "Simpson", "US13")
--------------

--------------
INSERT INTO passenger (pID,firstName,lastName,passportNum) VALUES (34, "Lisa", "Simpson", "US14")
--------------

--------------
INSERT INTO passenger (pID,firstName,lastName,passportNum) VALUES (35, "Maggie", "Simpson", "US15")
--------------

--------------
INSERT INTO passenger (pID,firstName,lastName,passportNum) VALUES (44, "Ned", "Flanders", "US22")
--------------

--------------
INSERT INTO passenger (pID,firstName,lastName,passportNum) VALUES (45, "Todd", "Flanders", "US23")
--------------

--------------
INSERT INTO passenger (pID,firstName,lastName,passportNum) VALUES (66, "Heidi", "Klum", "GE11")
--------------

--------------
INSERT INTO passenger (pID,firstName,lastName,passportNum) VALUES (77, "Michael", "Scott", "US88")
--------------

--------------
INSERT INTO passenger (pID,firstName,lastName,passportNum) VALUES (78, "Dwight", "Schrute", "US89")
--------------

--------------
INSERT INTO passenger (pID,firstName,lastName,passportNum) VALUES (79, "Pam", "Beesly", "US90")
--------------

--------------
INSERT INTO passenger (pID,firstName,lastName,passportNum) VALUES (80, "Creed", "Bratton", "US91")
--------------

--------------
INSERT INTO passenger (pID,firstName,lastName,passportNum) VALUES (90, "Shawn", "Kim", "US91")
--------------

--------------
SELECT * FROM passenger
--------------

+-----------+----------+-----+-------------+
| firstName | lastName | pID | passportNum |
+-----------+----------+-----+-------------+
| Homer     | Simpson  |  11 | US10        |
| Marge     | Simpson  |  22 | US12        |
| Bart      | Simpson  |  33 | US13        |
| Lisa      | Simpson  |  34 | US14        |
| Maggie    | Simpson  |  35 | US15        |
| Ned       | Flanders |  44 | US22        |
| Todd      | Flanders |  45 | US23        |
| Heidi     | Klum     |  66 | GE11        |
| Michael   | Scott    |  77 | US88        |
| Dwight    | Schrute  |  78 | US89        |
| Pam       | Beesly   |  79 | US90        |
| Creed     | Bratton  |  80 | US91        |
| Shawn     | Kim      |  90 | US91        |
+-----------+----------+-----+-------------+
13 rows in set (0.00 sec)

--------------
SELECT * FROM booking
--------------

+------+--------+-------+
| pID  | tripID | price |
+------+--------+-------+
|   11 |      1 |   500 |
|   22 |      1 |   500 |
|   33 |      1 |   200 |
|   34 |      1 |   200 |
|   35 |      1 |   200 |
|   66 |      1 |   601 |
|   44 |      8 |   400 |
|   45 |      8 |   200 |
|   78 |      4 |   600 |
|   80 |      4 |   600 |
|   78 |      1 |   550 |
|   33 |      8 |   300 |
|   34 |      8 |   300 |
|   11 |      6 |   600 |
|   22 |      6 |   600 |
|   33 |      6 |   100 |
|   34 |      6 |   100 |
|   35 |      6 |   100 |
|   11 |      7 |   300 |
|   44 |      7 |   400 |
|   77 |      7 |   500 |
|   90 |     10 |   400 |
+------+--------+-------+
22 rows in set (0.00 sec)

--------------
INSERT INTO booking(pID,tripID,price)VALUES(11,1,500)
--------------

Query OK, 1 row affected (0.03 sec)

--------------
INSERT INTO booking(pID,tripID,price)VALUES(22,1,500)
--------------

Query OK, 1 row affected (0.01 sec)

--------------
INSERT INTO booking(pID,tripID,price)VALUES(33,1,200)
--------------

Query OK, 1 row affected (0.01 sec)

--------------
INSERT INTO booking(pID,tripID,price)VALUES(34,1,200)
--------------

Query OK, 1 row affected (0.01 sec)

--------------
INSERT INTO booking(pID,tripID,price)VALUES(35,1,200)
--------------

Query OK, 1 row affected (0.02 sec)

--------------
INSERT INTO booking(pID,tripID,price)VALUES(66,1,600.99)
--------------

Query OK, 1 row affected, 1 warning (0.00 sec)

--------------
INSERT INTO booking(pID,tripID,price)VALUES(44,8,400)
--------------

Query OK, 1 row affected (0.01 sec)

--------------
INSERT INTO booking(pID,tripID,price)VALUES(45,8,200)
--------------

Query OK, 1 row affected (0.01 sec)

--------------
INSERT INTO booking(pID,tripID,price)VALUES(78,4,600)
--------------

Query OK, 1 row affected (0.01 sec)

--------------
INSERT INTO booking(pID,tripID,price)VALUES(80,4,600)
--------------

Query OK, 1 row affected (0.00 sec)

--------------
INSERT INTO booking(pID,tripID,price)VALUES(78,1,550)
--------------

Query OK, 1 row affected (0.01 sec)

--------------
INSERT INTO booking(pID,tripID,price)VALUES(33,8,300)
--------------

Query OK, 1 row affected (0.01 sec)

--------------
INSERT INTO booking(pID,tripID,price)VALUES(34,8,300)
--------------

Query OK, 1 row affected (0.01 sec)

--------------
INSERT INTO booking(pID,tripID,price)VALUES(11,6,600)
--------------

Query OK, 1 row affected (0.00 sec)

--------------
INSERT INTO booking(pID,tripID,price)VALUES(22,6,600)
--------------

Query OK, 1 row affected (0.01 sec)

--------------
INSERT INTO booking(pID,tripID,price)VALUES(33,6,100)
--------------

Query OK, 1 row affected (0.01 sec)

--------------
INSERT INTO booking(pID,tripID,price)VALUES(34,6,100)
--------------

Query OK, 1 row affected (0.01 sec)

--------------
INSERT INTO booking(pID,tripID,price)VALUES(35,6,100)
--------------

Query OK, 1 row affected (0.01 sec)

--------------
INSERT INTO booking(pID,tripID,price)VALUES(11,7,300)
--------------

Query OK, 1 row affected (0.01 sec)

--------------
INSERT INTO booking(pID,tripID,price)VALUES(44,7,400)
--------------

Query OK, 1 row affected (0.00 sec)

--------------
INSERT INTO booking(pID,tripID,price)VALUES(77,7,500)
--------------

Query OK, 1 row affected (0.01 sec)

--------------
INSERT INTO booking(pID,tripID,price)VALUES(90,10,400)
--------------

Query OK, 1 row affected (0.01 sec)

--------------
SELECT * FROM booking
--------------

+------+--------+-------+
| pID  | tripID | price |
+------+--------+-------+
|   11 |      1 |   500 |
|   22 |      1 |   500 |
|   33 |      1 |   200 |
|   34 |      1 |   200 |
|   35 |      1 |   200 |
|   66 |      1 |   601 |
|   44 |      8 |   400 |
|   45 |      8 |   200 |
|   78 |      4 |   600 |
|   80 |      4 |   600 |
|   78 |      1 |   550 |
|   33 |      8 |   300 |
|   34 |      8 |   300 |
|   11 |      6 |   600 |
|   22 |      6 |   600 |
|   33 |      6 |   100 |
|   34 |      6 |   100 |
|   35 |      6 |   100 |
|   11 |      7 |   300 |
|   44 |      7 |   400 |
|   77 |      7 |   500 |
|   90 |     10 |   400 |
|   11 |      1 |   500 |
|   22 |      1 |   500 |
|   33 |      1 |   200 |
|   34 |      1 |   200 |
|   35 |      1 |   200 |
|   66 |      1 |   601 |
|   44 |      8 |   400 |
|   45 |      8 |   200 |
|   78 |      4 |   600 |
|   80 |      4 |   600 |
|   78 |      1 |   550 |
|   33 |      8 |   300 |
|   34 |      8 |   300 |
|   11 |      6 |   600 |
|   22 |      6 |   600 |
|   33 |      6 |   100 |
|   34 |      6 |   100 |
|   35 |      6 |   100 |
|   11 |      7 |   300 |
|   44 |      7 |   400 |
|   77 |      7 |   500 |
|   90 |     10 |   400 |
+------+--------+-------+
44 rows in set (0.00 sec)

--------------
SELECT * FROM passport
--------------

+------------+-------------+------------+-------------+
| birth      | passportNum | expiry     | citizenship |
+------------+-------------+------------+-------------+
| 1970-07-12 | GE11        | 2027-01-01 | Germany     |
| 1970-02-19 | US10        | 2025-01-01 | USA         |
| 1972-08-12 | US12        | 2025-01-01 | USA         |
| 2001-05-12 | US13        | 2025-01-01 | USA         |
| 2004-03-19 | US14        | 2025-01-01 | USA         |
| 2012-09-17 | US15        | 2025-01-01 | USA         |
| 1950-06-11 | US22        | 2030-04-04 | USA         |
| 1940-06-24 | US23        | 2018-03-03 | USA         |
| 1979-02-19 | US56        | 2025-01-01 | USA         |
| 1979-04-25 | US88        | 2030-02-13 | Canada      |
| 1976-04-08 | US89        | 2022-02-02 | Germany     |
| 1980-04-04 | US90        | 2020-02-28 | Italy       |
| 1959-02-02 | US91        | 2030-01-01 | Germany     |
+------------+-------------+------------+-------------+
13 rows in set (0.00 sec)

--------------
UPDATE passport SET citizenship='Germany' WHERE passportNum in(SELECT passportNum FROM passenger WHERE firstName ='Dwight' AND lastName ='Schrute')
--------------

Query OK, 0 rows affected (0.01 sec)
Rows matched: 1  Changed: 0  Warnings: 0

--------------
SELECT * from passport
--------------

+------------+-------------+------------+-------------+
| birth      | passportNum | expiry     | citizenship |
+------------+-------------+------------+-------------+
| 1970-07-12 | GE11        | 2027-01-01 | Germany     |
| 1970-02-19 | US10        | 2025-01-01 | USA         |
| 1972-08-12 | US12        | 2025-01-01 | USA         |
| 2001-05-12 | US13        | 2025-01-01 | USA         |
| 2004-03-19 | US14        | 2025-01-01 | USA         |
| 2012-09-17 | US15        | 2025-01-01 | USA         |
| 1950-06-11 | US22        | 2030-04-04 | USA         |
| 1940-06-24 | US23        | 2018-03-03 | USA         |
| 1979-02-19 | US56        | 2025-01-01 | USA         |
| 1979-04-25 | US88        | 2030-02-13 | Canada      |
| 1976-04-08 | US89        | 2022-02-02 | Germany     |
| 1980-04-04 | US90        | 2020-02-28 | Italy       |
| 1959-02-02 | US91        | 2030-01-01 | Germany     |
+------------+-------------+------------+-------------+
13 rows in set (0.00 sec)

--------------
SELECT * FROM busTrip
--------------

+------------+------------+------------+----------------------------+--------+----------+
| start      | end        | county     | tripName                   | tripID | plateNum |
+------------+------------+------------+----------------------------+--------+----------+
| 2022-01-01 | 2022-01-17 | Germany    | Castles of Germany         |      1 | VAN1111  |
| 2022-03-03 | 2022-03-14 | Italy      | Tuscany Sunsets            |      2 | TAXI222  |
| 2022-05-05 | 2022-05-10 | USA        | California Wines           |      3 | VAN1111  |
| 2022-04-04 | 2022-04-14 | Bermuda    | Beaches Galore             |      4 | TAXI222  |
| 2022-06-01 | 2022-06-22 | Canada     | Cottage Country            |      5 | CAND123  |
| 2022-07-05 | 2022-07-15 | Italy      | Arrivaderci Roma           |      6 | TAXI111  |
| 2022-09-09 | 2022-09-29 | UK         | Shetland and Orkney        |      7 | TAXI111  |
| 2022-06-10 | 2022-06-20 | USA        | Disney World and Sea World |      8 | VAN1111  |
| 2022-02-05 | 2022-02-10 | USA        | Kingston Jamaica           |      9 | VAN1111  |
| 2022-09-05 | 2022-09-15 | Mozambique | Maputo                     |     10 | CAND123  |
+------------+------------+------------+----------------------------+--------+----------+
10 rows in set (0.00 sec)

--------------
UPDATE busTrip SET plateNum='VAN1111' WHERE county ='USA'
--------------

Query OK, 0 rows affected (0.01 sec)
Rows matched: 3  Changed: 0  Warnings: 0

--------------
SELECT * FROM busTrip
--------------

+------------+------------+------------+----------------------------+--------+----------+
| start      | end        | county     | tripName                   | tripID | plateNum |
+------------+------------+------------+----------------------------+--------+----------+
| 2022-01-01 | 2022-01-17 | Germany    | Castles of Germany         |      1 | VAN1111  |
| 2022-03-03 | 2022-03-14 | Italy      | Tuscany Sunsets            |      2 | TAXI222  |
| 2022-05-05 | 2022-05-10 | USA        | California Wines           |      3 | VAN1111  |
| 2022-04-04 | 2022-04-14 | Bermuda    | Beaches Galore             |      4 | TAXI222  |
| 2022-06-01 | 2022-06-22 | Canada     | Cottage Country            |      5 | CAND123  |
| 2022-07-05 | 2022-07-15 | Italy      | Arrivaderci Roma           |      6 | TAXI111  |
| 2022-09-09 | 2022-09-29 | UK         | Shetland and Orkney        |      7 | TAXI111  |
| 2022-06-10 | 2022-06-20 | USA        | Disney World and Sea World |      8 | VAN1111  |
| 2022-02-05 | 2022-02-10 | USA        | Kingston Jamaica           |      9 | VAN1111  |
| 2022-09-05 | 2022-09-15 | Mozambique | Maputo                     |     10 | CAND123  |
+------------+------------+------------+----------------------------+--------+----------+
10 rows in set (0.00 sec)

Bye
