Warning: Using a password on the command line interface can be insecure.
ERROR 1050 (42S01) at line 2: Table 'pplOnTrip' already exists
--------------
CREATE VIEW pplOnTrip AS SELECT firstName,lastName,tripName,price FROM passenger,busTrip,booking WHERE passenger.pID = booking.pID AND busTrip.tripID = booking.tripID
--------------

--------------
SELECT* FROM pplOnTrip
--------------

+-----------+----------+----------------------------+-------+
| firstName | lastName | tripName                   | price |
+-----------+----------+----------------------------+-------+
| Ned       | Flanders | Disney World and Sea World |   400 |
| Ned       | Flanders | Shetland and Orkney        |   400 |
| Ned       | Flanders | Disney World and Sea World |   400 |
| Ned       | Flanders | Shetland and Orkney        |   400 |
| Todd      | Flanders | Disney World and Sea World |   200 |
| Todd      | Flanders | Disney World and Sea World |   200 |
| Heidi     | Klum     | Castles of Germany         |   601 |
| Heidi     | Klum     | Castles of Germany         |   601 |
| Michael   | Scott    | Shetland and Orkney        |   500 |
| Michael   | Scott    | Shetland and Orkney        |   500 |
| Dwight    | Schrute  | Beaches Galore             |   600 |
| Dwight    | Schrute  | Castles of Germany         |   550 |
| Dwight    | Schrute  | Beaches Galore             |   600 |
| Dwight    | Schrute  | Castles of Germany         |   550 |
| Creed     | Bratton  | Beaches Galore             |   600 |
| Creed     | Bratton  | Beaches Galore             |   600 |
| Shawn     | Kim      | Maputo                     |   400 |
| Shawn     | Kim      | Maputo                     |   400 |
+-----------+----------+----------------------------+-------+
18 rows in set (0.00 sec)

--------------
SELECT firstName,lastName,tripName,price FROM pplOnTrip WHERE tripName LIKE "%Castles%"
--------------

+-----------+----------+--------------------+-------+
| firstName | lastName | tripName           | price |
+-----------+----------+--------------------+-------+
| Heidi     | Klum     | Castles of Germany |   601 |
| Heidi     | Klum     | Castles of Germany |   601 |
| Dwight    | Schrute  | Castles of Germany |   550 |
| Dwight    | Schrute  | Castles of Germany |   550 |
+-----------+----------+--------------------+-------+
4 rows in set (0.00 sec)

--------------
SELECT * FROM bus
--------------

+----------+----------+
| capacity | plateNum |
+----------+----------+
|       50 | CAND123  |
|        4 | TAXI111  |
|        3 | TAXI222  |
|        4 | TAXI333  |
|       10 | VAN1111  |
|       15 | VAN2222  |
+----------+----------+
6 rows in set (0.00 sec)

--------------
DELETE FROM bus WHERE plateNum LIKE "%UWO%"
--------------

Query OK, 0 rows affected (0.00 sec)

--------------
SELECT * FROM bus
--------------

+----------+----------+
| capacity | plateNum |
+----------+----------+
|       50 | CAND123  |
|        4 | TAXI111  |
|        3 | TAXI222  |
|        4 | TAXI333  |
|       10 | VAN1111  |
|       15 | VAN2222  |
+----------+----------+
6 rows in set (0.00 sec)

--------------
SELECT * FROM passport
--------------

+------------+-------------+------------+-------------+
| birth      | passportNum | expiry     | citizenship |
+------------+-------------+------------+-------------+
| 1970-07-12 | GE11        | 2027-01-01 | Germany     |
| 1970-02-19 | US10        | 2025-01-01 | USA         |
| 1972-08-12 | US12        | 2025-01-01 | USA         |
| 2001-05-12 | US13        | 2025-01-01 | USA         |
| 2004-03-19 | US14        | 2025-01-01 | USA         |
| 2012-09-17 | US15        | 2025-01-01 | USA         |
| 1950-06-11 | US22        | 2030-04-04 | USA         |
| 1940-06-24 | US23        | 2018-03-03 | USA         |
| 1979-02-19 | US56        | 2025-01-01 | USA         |
| 1979-04-25 | US88        | 2030-02-13 | Canada      |
| 1976-04-08 | US89        | 2022-02-02 | Germany     |
| 1980-04-04 | US90        | 2020-02-28 | Italy       |
| 1959-02-02 | US91        | 2030-01-01 | Germany     |
+------------+-------------+------------+-------------+
13 rows in set (0.00 sec)

--------------
SELECT * FROM passenger
--------------

+-----------+----------+-----+-------------+
| firstName | lastName | pID | passportNum |
+-----------+----------+-----+-------------+
| Homer     | Simpson  |  11 | US10        |
| Marge     | Simpson  |  22 | US12        |
| Bart      | Simpson  |  33 | US13        |
| Lisa      | Simpson  |  34 | US14        |
| Maggie    | Simpson  |  35 | US15        |
| Ned       | Flanders |  44 | US22        |
| Todd      | Flanders |  45 | US23        |
| Heidi     | Klum     |  66 | GE11        |
| Michael   | Scott    |  77 | US88        |
| Dwight    | Schrute  |  78 | US89        |
| Creed     | Bratton  |  80 | US91        |
| Shawn     | Kim      |  90 | US91        |
+-----------+----------+-----+-------------+
12 rows in set (0.00 sec)

ERROR 1451 (23000) at line 10: Cannot delete or update a parent row: a foreign key constraint fails (`36_assign2db`.`booking`, CONSTRAINT `booking_ibfk_1` FOREIGN KEY (`pID`) REFERENCES `passenger` (`pID`))
--------------
DELETE FROM passenger WHERE passportNum IN(SELECT passportNum FROM passport WHERE citizenship = "Canada")
--------------

--------------
SELECT * FROM passport
--------------

+------------+-------------+------------+-------------+
| birth      | passportNum | expiry     | citizenship |
+------------+-------------+------------+-------------+
| 1970-07-12 | GE11        | 2027-01-01 | Germany     |
| 1970-02-19 | US10        | 2025-01-01 | USA         |
| 1972-08-12 | US12        | 2025-01-01 | USA         |
| 2001-05-12 | US13        | 2025-01-01 | USA         |
| 2004-03-19 | US14        | 2025-01-01 | USA         |
| 2012-09-17 | US15        | 2025-01-01 | USA         |
| 1950-06-11 | US22        | 2030-04-04 | USA         |
| 1940-06-24 | US23        | 2018-03-03 | USA         |
| 1979-02-19 | US56        | 2025-01-01 | USA         |
| 1979-04-25 | US88        | 2030-02-13 | Canada      |
| 1976-04-08 | US89        | 2022-02-02 | Germany     |
| 1980-04-04 | US90        | 2020-02-28 | Italy       |
| 1959-02-02 | US91        | 2030-01-01 | Germany     |
+------------+-------------+------------+-------------+
13 rows in set (0.00 sec)

--------------
SELECT * FROM busTrip
--------------

+------------+------------+------------+----------------------------+--------+----------+
| start      | end        | county     | tripName                   | tripID | plateNum |
+------------+------------+------------+----------------------------+--------+----------+
| 2022-01-01 | 2022-01-17 | Germany    | Castles of Germany         |      1 | VAN1111  |
| 2022-03-03 | 2022-03-14 | Italy      | Tuscany Sunsets            |      2 | TAXI222  |
| 2022-04-04 | 2022-04-14 | Bermuda    | Beaches Galore             |      4 | TAXI222  |
| 2022-06-01 | 2022-06-22 | Canada     | Cottage Country            |      5 | CAND123  |
| 2022-07-05 | 2022-07-15 | Italy      | Arrivaderci Roma           |      6 | TAXI111  |
| 2022-09-09 | 2022-09-29 | UK         | Shetland and Orkney        |      7 | TAXI111  |
| 2022-06-10 | 2022-06-20 | USA        | Disney World and Sea World |      8 | VAN1111  |
| 2022-02-05 | 2022-02-10 | USA        | Kingston Jamaica           |      9 | VAN1111  |
| 2022-09-05 | 2022-09-15 | Mozambique | Maputo                     |     10 | CAND123  |
+------------+------------+------------+----------------------------+--------+----------+
9 rows in set (0.00 sec)

--------------
DELETE FROM busTrip WHERE tripName = 'California Wines'
--------------

Query OK, 0 rows affected (0.00 sec)

--------------
SELECT * FROM busTrip
--------------

+------------+------------+------------+----------------------------+--------+----------+
| start      | end        | county     | tripName                   | tripID | plateNum |
+------------+------------+------------+----------------------------+--------+----------+
| 2022-01-01 | 2022-01-17 | Germany    | Castles of Germany         |      1 | VAN1111  |
| 2022-03-03 | 2022-03-14 | Italy      | Tuscany Sunsets            |      2 | TAXI222  |
| 2022-04-04 | 2022-04-14 | Bermuda    | Beaches Galore             |      4 | TAXI222  |
| 2022-06-01 | 2022-06-22 | Canada     | Cottage Country            |      5 | CAND123  |
| 2022-07-05 | 2022-07-15 | Italy      | Arrivaderci Roma           |      6 | TAXI111  |
| 2022-09-09 | 2022-09-29 | UK         | Shetland and Orkney        |      7 | TAXI111  |
| 2022-06-10 | 2022-06-20 | USA        | Disney World and Sea World |      8 | VAN1111  |
| 2022-02-05 | 2022-02-10 | USA        | Kingston Jamaica           |      9 | VAN1111  |
| 2022-09-05 | 2022-09-15 | Mozambique | Maputo                     |     10 | CAND123  |
+------------+------------+------------+----------------------------+--------+----------+
9 rows in set (0.00 sec)

--------------
DELETE FROM busTrip WHERE tripName ='Arrivaderci Roma'
--------------

Query OK, 1 row affected (0.06 sec)

--------------
SELECT * FROM passenger
--------------

+-----------+----------+-----+-------------+
| firstName | lastName | pID | passportNum |
+-----------+----------+-----+-------------+
| Homer     | Simpson  |  11 | US10        |
| Marge     | Simpson  |  22 | US12        |
| Bart      | Simpson  |  33 | US13        |
| Lisa      | Simpson  |  34 | US14        |
| Maggie    | Simpson  |  35 | US15        |
| Ned       | Flanders |  44 | US22        |
| Todd      | Flanders |  45 | US23        |
| Heidi     | Klum     |  66 | GE11        |
| Michael   | Scott    |  77 | US88        |
| Dwight    | Schrute  |  78 | US89        |
| Creed     | Bratton  |  80 | US91        |
| Shawn     | Kim      |  90 | US91        |
+-----------+----------+-----+-------------+
12 rows in set (0.00 sec)

--------------
DELETE FROM passenger WHERE firstName = 'Pam'
--------------

Query OK, 0 rows affected (0.00 sec)

--------------
SELECT * FROM passenger
--------------

+-----------+----------+-----+-------------+
| firstName | lastName | pID | passportNum |
+-----------+----------+-----+-------------+
| Homer     | Simpson  |  11 | US10        |
| Marge     | Simpson  |  22 | US12        |
| Bart      | Simpson  |  33 | US13        |
| Lisa      | Simpson  |  34 | US14        |
| Maggie    | Simpson  |  35 | US15        |
| Ned       | Flanders |  44 | US22        |
| Todd      | Flanders |  45 | US23        |
| Heidi     | Klum     |  66 | GE11        |
| Michael   | Scott    |  77 | US88        |
| Dwight    | Schrute  |  78 | US89        |
| Creed     | Bratton  |  80 | US91        |
| Shawn     | Kim      |  90 | US91        |
+-----------+----------+-----+-------------+
12 rows in set (0.00 sec)

--------------
SELECT* FROM pplOnTrip
--------------

+-----------+----------+----------------------------+-------+
| firstName | lastName | tripName                   | price |
+-----------+----------+----------------------------+-------+
| Ned       | Flanders | Disney World and Sea World |   400 |
| Ned       | Flanders | Shetland and Orkney        |   400 |
| Ned       | Flanders | Disney World and Sea World |   400 |
| Ned       | Flanders | Shetland and Orkney        |   400 |
| Todd      | Flanders | Disney World and Sea World |   200 |
| Todd      | Flanders | Disney World and Sea World |   200 |
| Heidi     | Klum     | Castles of Germany         |   601 |
| Heidi     | Klum     | Castles of Germany         |   601 |
| Michael   | Scott    | Shetland and Orkney        |   500 |
| Michael   | Scott    | Shetland and Orkney        |   500 |
| Dwight    | Schrute  | Beaches Galore             |   600 |
| Dwight    | Schrute  | Castles of Germany         |   550 |
| Dwight    | Schrute  | Beaches Galore             |   600 |
| Dwight    | Schrute  | Castles of Germany         |   550 |
| Creed     | Bratton  | Beaches Galore             |   600 |
| Creed     | Bratton  | Beaches Galore             |   600 |
| Shawn     | Kim      | Maputo                     |   400 |
| Shawn     | Kim      | Maputo                     |   400 |
+-----------+----------+----------------------------+-------+
18 rows in set (0.00 sec)

--------------
DELETE FROM booking WHERE pID IN (SELECT pID FROM passenger WHERE passenger.lastName ='Simpson')
--------------

Query OK, 0 rows affected (0.00 sec)

--------------
SELECT* FROM pplOnTrip
--------------

+-----------+----------+----------------------------+-------+
| firstName | lastName | tripName                   | price |
+-----------+----------+----------------------------+-------+
| Ned       | Flanders | Disney World and Sea World |   400 |
| Ned       | Flanders | Shetland and Orkney        |   400 |
| Ned       | Flanders | Disney World and Sea World |   400 |
| Ned       | Flanders | Shetland and Orkney        |   400 |
| Todd      | Flanders | Disney World and Sea World |   200 |
| Todd      | Flanders | Disney World and Sea World |   200 |
| Heidi     | Klum     | Castles of Germany         |   601 |
| Heidi     | Klum     | Castles of Germany         |   601 |
| Michael   | Scott    | Shetland and Orkney        |   500 |
| Michael   | Scott    | Shetland and Orkney        |   500 |
| Dwight    | Schrute  | Beaches Galore             |   600 |
| Dwight    | Schrute  | Castles of Germany         |   550 |
| Dwight    | Schrute  | Beaches Galore             |   600 |
| Dwight    | Schrute  | Castles of Germany         |   550 |
| Creed     | Bratton  | Beaches Galore             |   600 |
| Creed     | Bratton  | Beaches Galore             |   600 |
| Shawn     | Kim      | Maputo                     |   400 |
| Shawn     | Kim      | Maputo                     |   400 |
+-----------+----------+----------------------------+-------+
18 rows in set (0.00 sec)

Bye
